{
  "$schema": "https://json-schema.org/draft/2020-12/schema",
  "type": "array",
  "items": {
    "type": "object",
    "required": [
      "id",
      "question",
      "question_type",
      "source_filename",
      "page",
      "supporting_quote",
      "proposed_answer",
      "claim_supports",
      "plausible_distractors",
      "human_verified"
    ],
    "properties": {
      "id": {
        "type": "string"
      },
      "question": {
        "type": "string"
      },
      "question_type": {
        "enum": [
          "factual",
          "method",
          "result",
          "limitation",
          "comparison",
          "multi_hop"
        ]
      },
      "source_filename": {
        "type": "string",
        "pattern": "\\.pdf$"
      },
      "page": {
        "type": "integer",
        "minimum": 1
      },
      "supporting_quote": {
        "type": "string"
      },
      "proposed_answer": {
        "type": "string"
      },
      "claim_supports": {
        "type": "array",
        "items": {
          "type": "object",
          "required": ["claim", "source_filename", "page", "quote"],
          "properties": {
            "claim": { "type": "string" },
            "source_filename": { "type": "string" },
            "page": { "type": "integer", "minimum": 1 },
            "quote": { "type": "string" }
          }
        }
      },
      "plausible_distractors": {
        "type": "array",
        "items": {
          "type": "string"
        }
      },
      "human_verified": {
        "type": "boolean"
      },
      "reviewer": {
        "type": ["string", "null"]
      },
      "review_date": {
        "type": ["string", "null"]
      },
      "provenance": {
        "type": ["string", "null"]
      }
    }
  }
}
