[
  {
    "id": "Q019",
    "question": "In Generative Adversarial Nets, what is the theoretical optimal discriminator D_G*(x) for a fixed generator G, and at what value of p_g is the global minimum of the virtual training criterion C(G) achieved?",
    "question_type": "result",
    "source_filename": "1406.2661v1.pdf",
    "page": 4,
    "supporting_quote": "Proposition 1. For G fixed, the optimal discriminator D is D*_G(x) = pdata(x) / (pdata(x) + pg(x))",
    "proposed_answer": "For a fixed generator G, the optimal discriminator is D*_G(x) = p_data(x) / (p_data(x) + p_g(x)). The virtual training criterion C(G) achieves its global minimum if and only if p_g = p_data, at which point C(G) reaches the value -log 4.",
    "claim_supports": [
      {
        "claim": "For a fixed generator G, the optimal discriminator is D*_G(x) = p_data(x) / (p_data(x) + p_g(x)).",
        "source_filename": "1406.2661v1.pdf",
        "page": 4,
        "quote": "Proposition 1. For G fixed, the optimal discriminator D is D*_G(x) = pdata(x) / (pdata(x) + pg(x))"
      },
      {
        "claim": "The global minimum of the virtual training criterion C(G) is achieved if and only if p_g = p_data, where C(G) achieves the value -log 4.",
        "source_filename": "1406.2661v1.pdf",
        "page": 5,
        "quote": "Theorem 1. The global minimum of the virtual training criterion C(G) is achieved if and only if pg = pdata. At that point, C(G) achieves the value -log 4."
      }
    ],
    "plausible_distractors": [
      "1512.03385v1.pdf",
      "1412.6980v9.pdf",
      "2005.11401v4.pdf"
    ],
    "human_verified": true,
    "reviewer": "project owner (user)",
    "review_date": "2026-10-20, Asia/Kolkata",
    "provenance": "Explicitly approved by project owner on 2026-10-20 against 1406.2661v1.pdf pp. 4-5"
  },
  {
    "id": "Q020",
    "question": "What default hyperparameter values does the Adam paper recommend for alpha, beta_1, beta_2, and epsilon, and what causes the initialization bias in the first and second moment estimates that requires correction?",
    "question_type": "method",
    "source_filename": "1412.6980v9.pdf",
    "page": 2,
    "supporting_quote": "Good default settings for the tested machine learning problems are alpha = 0.001, beta1 = 0.9, beta2 = 0.999 and epsilon = 10^-8.",
    "proposed_answer": "The authors recommend default settings of alpha = 0.001, beta_1 = 0.9, beta_2 = 0.999, and epsilon = 10^-8. Initialization bias is caused by initializing the running average vectors with zeros, which biases estimates toward zero during early timesteps.",
    "claim_supports": [
      {
        "claim": "The recommended default hyperparameter values are alpha = 0.001, beta_1 = 0.9, beta_2 = 0.999, and epsilon = 10^-8.",
        "source_filename": "1412.6980v9.pdf",
        "page": 2,
        "quote": "Good default settings for the tested machine learning problems are alpha = 0.001, beta1 = 0.9, beta2 = 0.999 and epsilon = 10^-8."
      },
      {
        "claim": "Initialization bias is caused by initializing the running averages with zeros, requiring division by (1 - beta^t) to correct.",
        "source_filename": "1412.6980v9.pdf",
        "page": 3,
        "quote": "which is caused by initializing the running average with zeros. In algorithm 1 we therefore divide by this term to correct the initialization bias."
      }
    ],
    "plausible_distractors": [
      "1406.2661v1.pdf",
      "1512.03385v1.pdf",
      "2401.15884v3.pdf"
    ],
    "human_verified": true,
    "reviewer": "project owner (user)",
    "review_date": "2026-10-20, Asia/Kolkata",
    "provenance": "Explicitly approved by project owner on 2026-10-20 against 1412.6980v9.pdf pp. 2-3"
  },
  {
    "id": "Q021",
    "question": "How does the deep residual learning framework formulate the building block mapping, and do the identity shortcut connections add extra parameters or computational complexity?",
    "question_type": "method",
    "source_filename": "1512.03385v1.pdf",
    "page": 2,
    "supporting_quote": "Formally, denoting the desired underlying mapping as H(x), we let the stacked nonlinear layers fit another mapping of F(x) := H(x)-x. The original mapping is recast into F(x)+x.",
    "proposed_answer": "Rather than fitting a direct underlying mapping H(x), the stacked nonlinear layers explicitly fit a residual mapping F(x) := H(x) - x, recasting the original mapping as F(x) + x. The identity shortcut connections introduce neither extra parameters nor computational complexity.",
    "claim_supports": [
      {
        "claim": "The stacked nonlinear layers fit the residual mapping F(x) := H(x) - x, recasting the output as F(x) + x.",
        "source_filename": "1512.03385v1.pdf",
        "page": 2,
        "quote": "Formally, denoting the desired underlying mapping as H(x), we let the stacked nonlinear layers fit another mapping of F(x) := H(x)-x. The original mapping is recast into F(x)+x."
      },
      {
        "claim": "Identity shortcut connections add neither extra parameters nor computational complexity.",
        "source_filename": "1512.03385v1.pdf",
        "page": 3,
        "quote": "The shortcut connections in Eqn.(1) introduce neither extra parameter nor computation complexity."
      }
    ],
    "plausible_distractors": [
      "1406.2661v1.pdf",
      "1412.6980v9.pdf",
      "2002.08909v1.pdf"
    ],
    "human_verified": true,
    "reviewer": "project owner (user)",
    "review_date": "2026-10-20, Asia/Kolkata",
    "provenance": "Explicitly approved by project owner on 2026-10-20 against 1512.03385v1.pdf pp. 2-3"
  },
  {
    "id": "Q022",
    "question": "In Corrective Retrieval Augmented Generation (CRAG), what three knowledge retrieval actions can be triggered based on the retrieval evaluator's confidence score, and how does the system process retrieved knowledge under each action?",
    "question_type": "method",
    "source_filename": "2401.15884v3.pdf",
    "page": 5,
    "supporting_quote": "Based on the aforementioned confidence score for each retrieved document, three types of actions are designed and triggered accordingly where the upper and lower thresholds are set. If the confidence score is higher than the upper threshold, the retrieved document is identified as Correct, while identified as Incorrect if below the lower threshold. Otherwise, a more soft and intermediate action, i.e., Ambiguous is executed.",
    "proposed_answer": "CRAG triggers three actions: Correct (confidence > upper threshold), Incorrect (all confidence scores < lower threshold), and Ambiguous (intermediate scores). Under Correct, retrieved documents are refined via decompose-then-recompose knowledge refinement; under Incorrect, retrieved documents are discarded and external web search is executed; under Ambiguous, refined internal knowledge and external web search results are combined.",
    "claim_supports": [
      {
        "claim": "If confidence exceeds the upper threshold, Correct triggers decompose-then-recompose refinement into internal knowledge strips.",
        "source_filename": "2401.15884v3.pdf",
        "page": 5,
        "quote": "If the confidence score is higher than the upper threshold, the retrieved document is identified as Correct... a knowledge refinement method is further designed which will be elaborated in Section 4.4."
      },
      {
        "claim": "If all confidence scores fall below the lower threshold, Incorrect discards retrieved documents and triggers external web search.",
        "source_filename": "2401.15884v3.pdf",
        "page": 5,
        "quote": "a retrieval is assumed Incorrect when the confidence scores of all retrieved documents are below the lower threshold... Here, web search is introduced to search from the Internet as elaborated in Section 4.5."
      },
      {
        "claim": "Under Ambiguous, both refined internal knowledge and external web search results are combined.",
        "source_filename": "2401.15884v3.pdf",
        "page": 5,
        "quote": "both types of processed knowledge in Correct and Incorrect are combined to complement each other."
      }
    ],
    "plausible_distractors": [
      "2005.11401v4.pdf",
      "2002.08909v1.pdf",
      "2310.11511v1.pdf"
    ],
    "human_verified": true,
    "reviewer": "project owner (user)",
    "review_date": "2026-10-20, Asia/Kolkata",
    "provenance": "Explicitly approved by project owner on 2026-10-20 against 2401.15884v3.pdf p. 5"
  },
  {
    "id": "Q023",
    "question": "In the Google File System (GFS), what is the default chunk size, how are chunk replicas stored on chunkservers, and what lazy mechanism avoids space wastage from internal fragmentation?",
    "question_type": "factual",
    "source_filename": "945445.945450.pdf",
    "page": 4,
    "supporting_quote": "Chunk size is 64 MB, which is much larger than typical file system block sizes. Each chunk replica is stored as a plain Linux file on a chunkserver and is extended only as needed. Lazy space allocation avoids wasting space due to internal fragmentation, perhaps the greatest objection against such a large chunk size.",
    "proposed_answer": "GFS uses a default chunk size of 64 MB. Each chunk replica is stored as a plain Linux file on a chunkserver and is extended only as needed. Lazy space allocation avoids wasting space due to internal fragmentation.",
    "claim_supports": [
      {
        "claim": "GFS uses a default chunk size of 64 MB.",
        "source_filename": "945445.945450.pdf",
        "page": 4,
        "quote": "Chunk size is 64 MB, which is much larger than typical file system block sizes."
      },
      {
        "claim": "Each chunk replica is stored as a plain Linux file on a chunkserver and extended only as needed.",
        "source_filename": "945445.945450.pdf",
        "page": 4,
        "quote": "Each chunk replica is stored as a plain Linux file on a chunkserver and is extended only as needed."
      },
      {